<?xml version="1.0" encoding="UTF-8"?>
<!-- Etapa 16 de La Vuelta 2026: Cortegana a La Rábida-Palos de la Frontera -->
<etapa xmlns="http://www.uniovi.es"
       xmlns:xsi="http://www.w3.org/2001/XMLSchema-instance"
       xsi:schemaLocation="http://www.uniovi.es etapa.xsd"
       numero="16" tipo="media-montana">
    <nombre>Cortegana a La Rábida-Palos de la Frontera</nombre>
    <distancia unidades="km">181.1</distancia>
    <fecha>2026-09-08</fecha>
    <tiempoGanador>PT3H56M33S</tiempoGanador>
    <velocidadMedia unidades="km/h">45.94</velocidadMedia>
    <desnivel unidades="m">1980</desnivel>

    <salida>
        <lugar>Cortegana</lugar>
        <coordenadas>
            <longitud unidades="grados">-6.802658</longitud>
            <latitud unidades="grados">37.888042</latitud>
            <altitud unidades="m">640</altitud>
        </coordenadas>
    </salida>

    <meta>
        <lugar>La Rábida. Palos de la Frontera</lugar>
        <coordenadas>
            <longitud unidades="grados">-6.922800</longitud>
            <latitud unidades="grados">37.208900</latitud>
            <altitud unidades="m">25</altitud>
        </coordenadas>
    </meta>

    <referencias>
        <referencia url="https://www.lavuelta.es/es/etapa-16">La Vuelta 2026 - Etapa 16 (web oficial)</referencia>
        <referencia url="https://www.lavuelta.es/es/patrimonio/etapa-16/ciudad/cortegana">Cortegana, ciudad de salida (La Vuelta)</referencia>
        <referencia url="https://www.lavuelta.es/es/patrimonio/etapa-16/ciudad/la-rabida-palos-de-la-frontera">La Rábida. Palos de la Frontera, ciudad de llegada (La Vuelta)</referencia>
        <referencia url="https://es.wikipedia.org/wiki/Cortegana">Cortegana - Wikipedia</referencia>
        <referencia url="https://es.wikipedia.org/wiki/Palos_de_la_Frontera">Palos de la Frontera - Wikipedia</referencia>
    </referencias>

    <fotografias>
        <fotografia titulo="Salida en Cortegana">multimedia/foto1.jpg</fotografia>
        <fotografia titulo="Llegada a La Rábida">multimedia/foto2.jpg</fotografia>
        <fotografia titulo="Pelotón en la etapa">multimedia/foto3.jpg</fotografia>
    </fotografias>

    <videos>
        <video titulo="Resumen de la etapa 16">multimedia/video1.mp4</video>
    </videos>

    <podcasts>
        <podcast titulo="Podcast de la etapa 16">multimedia/podcast1.mp3</podcast>
    </podcasts>

    <hitos>
        <sprint bonificable="false">
            <nombre>Villarrasa</nombre>
            <coordenadas>
                <longitud unidades="grados">-6.607600</longitud>
                <latitud unidades="grados">37.389900</latitud>
                <altitud unidades="m">70</altitud>
            </coordenadas>
            <distanciaSalida unidades="km">114.5</distanciaSalida>
        </sprint>
    </hitos>

    <puntos>
        <punto>
            <nombre>Almonaster la Real</nombre>
            <coordenadas>
                <longitud unidades="grados">-6.786600</longitud>
                <latitud unidades="grados">37.872200</latitud>
                <altitud unidades="m">613</altitud>
            </coordenadas>
            <distanciaSalida unidades="km">2</distanciaSalida>
        </punto>
        <punto>
            <nombre>Cruce izquierda dirección Jabugo</nombre>
            <coordenadas>
                <longitud unidades="grados">-6.752000</longitud>
                <latitud unidades="grados">37.885000</latitud>
                <altitud unidades="m">640</altitud>
            </coordenadas>
            <distanciaSalida unidades="km">9.1</distanciaSalida>
        </punto>
        <punto>
            <nombre>Aguafría</nombre>
            <coordenadas>
                <longitud unidades="grados">-6.745000</longitud>
                <latitud unidades="grados">37.895000</latitud>
                <altitud unidades="m">650</altitud>
            </coordenadas>
            <distanciaSalida unidades="km">11</distanciaSalida>
        </punto>
        <punto>
            <nombre>Cruce derecha dirección Castaño del Robledo</nombre>
            <coordenadas>
                <longitud unidades="grados">-6.727000</longitud>
                <latitud unidades="grados">37.912000</latitud>
                <altitud unidades="m">640</altitud>
            </coordenadas>
            <distanciaSalida unidades="km">14.6</distanciaSalida>
        </punto>
        <punto>
            <nombre>Castaño del Robledo</nombre>
            <coordenadas>
                <longitud unidades="grados">-6.701100</longitud>
                <latitud unidades="grados">37.900600</latitud>
                <altitud unidades="m">740</altitud>
            </coordenadas>
            <distanciaSalida unidades="km">17.7</distanciaSalida>
        </punto>
        <punto>
            <nombre>Fuenteheridos</nombre>
            <coordenadas>
                <longitud unidades="grados">-6.662000</longitud>
                <latitud unidades="grados">37.905000</latitud>
                <altitud unidades="m">717</altitud>
            </coordenadas>
            <distanciaSalida unidades="km">21.9</distanciaSalida>
        </punto>
        <punto>
            <nombre>Cruce derecha dirección Aracena</nombre>
            <coordenadas>
                <longitud unidades="grados">-6.645000</longitud>
                <latitud unidades="grados">37.902000</latitud>
                <altitud unidades="m">700</altitud>
            </coordenadas>
            <distanciaSalida unidades="km">23.6</distanciaSalida>
        </punto>
        <punto>
            <nombre>Aracena, rotonda dirección Alájar</nombre>
            <coordenadas>
                <longitud unidades="grados">-6.570000</longitud>
                <latitud unidades="grados">37.890500</latitud>
                <altitud unidades="m">690</altitud>
            </coordenadas>
            <distanciaSalida unidades="km">31.4</distanciaSalida>
        </punto>
        <punto>
            <nombre>Rotonda izquierda dirección Campofrío</nombre>
            <coordenadas>
                <longitud unidades="grados">-6.585000</longitud>
                <latitud unidades="grados">37.870000</latitud>
                <altitud unidades="m">620</altitud>
            </coordenadas>
            <distanciaSalida unidades="km">34.8</distanciaSalida>
        </punto>
        <punto>
            <nombre>Campofrío</nombre>
            <coordenadas>
                <longitud unidades="grados">-6.572000</longitud>
                <latitud unidades="grados">37.769000</latitud>
                <altitud unidades="m">530</altitud>
            </coordenadas>
            <distanciaSalida unidades="km">52.7</distanciaSalida>
        </punto>
        <punto>
            <nombre>La Dehesa</nombre>
            <coordenadas>
                <longitud unidades="grados">-6.586000</longitud>
                <latitud unidades="grados">37.715000</latitud>
                <altitud unidades="m">470</altitud>
            </coordenadas>
            <distanciaSalida unidades="km">60</distanciaSalida>
        </punto>
        <punto>
            <nombre>Minas de Riotinto</nombre>
            <coordenadas>
                <longitud unidades="grados">-6.595000</longitud>
                <latitud unidades="grados">37.693000</latitud>
                <altitud unidades="m">420</altitud>
            </coordenadas>
            <distanciaSalida unidades="km">63.1</distanciaSalida>
        </punto>
        <punto>
            <nombre>Cruce derecha dirección Las Delgadas</nombre>
            <coordenadas>
                <longitud unidades="grados">-6.601000</longitud>
                <latitud unidades="grados">37.686000</latitud>
                <altitud unidades="m">400</altitud>
            </coordenadas>
            <distanciaSalida unidades="km">64.1</distanciaSalida>
        </punto>
        <punto>
            <nombre>Cruce derecha dirección Marigenta</nombre>
            <coordenadas>
                <longitud unidades="grados">-6.620000</longitud>
                <latitud unidades="grados">37.660000</latitud>
                <altitud unidades="m">350</altitud>
            </coordenadas>
            <distanciaSalida unidades="km">67.9</distanciaSalida>
        </punto>
        <punto>
            <nombre>Cruce izquierda dirección Berrocal</nombre>
            <coordenadas>
                <longitud unidades="grados">-6.615000</longitud>
                <latitud unidades="grados">37.625000</latitud>
                <altitud unidades="m">330</altitud>
            </coordenadas>
            <distanciaSalida unidades="km">74</distanciaSalida>
        </punto>
        <punto>
            <nombre>Cruce derecha dirección La Palma del Condado</nombre>
            <coordenadas>
                <longitud unidades="grados">-6.575000</longitud>
                <latitud unidades="grados">37.570000</latitud>
                <altitud unidades="m">250</altitud>
            </coordenadas>
            <distanciaSalida unidades="km">81.5</distanciaSalida>
        </punto>
        <punto>
            <nombre>La Palma del Condado</nombre>
            <coordenadas>
                <longitud unidades="grados">-6.562000</longitud>
                <latitud unidades="grados">37.386000</latitud>
                <altitud unidades="m">90</altitud>
            </coordenadas>
            <distanciaSalida unidades="km">111</distanciaSalida>
        </punto>
        <punto>
            <nombre>Rotonda izquierda dirección Bonares</nombre>
            <coordenadas>
                <longitud unidades="grados">-6.670000</longitud>
                <latitud unidades="grados">37.365000</latitud>
                <altitud unidades="m">40</altitud>
            </coordenadas>
            <distanciaSalida unidades="km">121.6</distanciaSalida>
        </punto>
        <punto>
            <nombre>Cruce recto dirección Bonares</nombre>
            <coordenadas>
                <longitud unidades="grados">-6.678000</longitud>